{"decision_seal_sha256":"fb3892870778ac9a683cada3187190fdd643992987436a2b7623a2b2cf4e3ff6","decisions_sha256":"32d85f7815a2ef583e36e988ed330347198db056de04f3fa60bd4e42414c536f","identity_claims":0,"input_sha256":"c263eef97d3cd1662954a50748b3f9fadab5cf65ff79ac33ba80b909969699b3","review_session_id":"independent-session-20260713-ground-v1","reviewer_id":"independent-reviewer-pixel-ocr-v1","rows":[{"alternatives":[],"crop_sha256":"2315a3d890263177bdc6b76dcca67a8cd79f17ac8f3287bf937f95d316a26bc0","decision":"correct","evidence_scope":"literal_visual_transcription_only_not_identity","identity_status":"not_asserted","legibility":"partial","literal_text":"WHITE ROSE\nGASOLINE\nTHE PICK OF THEM ALL","neutral_crop_id":"ground-crop-01","parent_neutral_id":"ground-review-06","reason":"These three lines are independently readable from the crop, although vertical street fixtures obscure portions of several letters; the remaining strokes and spacing support a single literal reading.","source_region":{"native_xyxy":[2085,1112,2871,1429],"numeric_id":105,"original_sha256":"6addf1dba5df3db948f9241f0162a8c6b0bab4364dbd05b6af096977b0a4c9c8","region_id":"white-rose"}},{"alternatives":[],"crop_sha256":"04c8232ecdeb0f04319aa4c1344dd233b595e8cf200639a8741a0cd6674c4742","decision":"correct","evidence_scope":"literal_visual_transcription_only_not_identity","identity_status":"not_asserted","legibility":"clear","literal_text":"CATELLI\nEGG NOODLES","neutral_crop_id":"ground-crop-02","parent_neutral_id":"ground-review-06","reason":"Both lines are independently and clearly readable in the crop, with no competing literal transcription visible.","source_region":{"native_xyxy":[316,866,714,1030],"numeric_id":105,"original_sha256":"6addf1dba5df3db948f9241f0162a8c6b0bab4364dbd05b6af096977b0a4c9c8","region_id":"catelli-egg-noodles"}}],"schema_version":"ground_originals_reviewed_visual_transcriptions_v1.0.0"}
